{
  "schema_version": 1,
  "handoff_id": "example-task-developer-to-tester",
  "task_id": "example-task",
  "task_revision": 1,
  "created_at": "2026-01-01T00:00:00.000Z",
  "actor_id": "developer-1",
  "role": "developer",
  "stage": "produce",
  "summary": "Implementation artifacts are ready for verification.",
  "artifact_refs": [
    {
      "locator": "src/example.mjs",
      "version": "git:HEAD"
    }
  ],
  "decision_refs": [],
  "evidence_refs": [],
  "finding_refs": [],
  "blocker_refs": [],
  "next": {
    "role": "tester",
    "stage": "verify",
    "action": "Run the acceptance checks and report observed evidence."
  }
}
